Title,Year,Rated,Released,Runtime,Genre,Director,Writer,Actors,Language,Country,Awards,Ratings,Metascore,imdbRating,imdbVotes,imdbID,Type,DVD,BoxOffice,Production,Website,Studio,Total Gross,Theaters,Opening Gross,Theaters(opening),Open
By Hook or by Crook,2001,N/A,17 Jun 2001,98 min,"Crime, Drama, Romance","Harry Dodge, Silas Howard","Harry Dodge, Silas Howard, Stanya Kahn (contributing writer)","Silas Howard, Harry Dodge, Stanya Kahn, Carina Gia",English,USA,7 wins.,"[{'Source': 'Internet Movie Database', 'Value': '5.8/10'}, {'Source': 'Rotten Tomatoes', 'Value': '62%'}, {'Source': 'Metacritic', 'Value': '47/100'}]",47,5.8,235,tt0290498,movie,27 May 2003,N/A,Artistic License Films,http://www.steakhaus.com/bhobc,b'AL',"b'$1,802'",b'2',"b'$1,802'",b'2',b'10/25/2002'
By the Light of the Silvery Moon,1953,APPROVED,15 Feb 1954,101 min,"Comedy, Family, Musical",David Butler,"Robert O'Brien, Irving Elinson, Booth Tarkington (suggested by: 'Penrod' stories)","Doris Day, Gordon MacRae, Leon Ames, Rosemary DeCamp",English,USA,N/A,"[{'Source': 'Internet Movie Database', 'Value': '7.1/10'}]",N/A,7.1,"1,575",tt0045586,movie,10 Apr 2007,N/A,Warner Bros.,N/A,b'WB',b'n/a',b'n/a',b'n/a',b'n/a',b'3/26/1953'
By the Sea,2015,R,09 Dec 2015,122 min,"Drama, Romance",Angelina Jolie,Angelina Jolie,"Brad Pitt, Angelina Jolie, Mélanie Laurent, Melvil Poupaud","English, French, Ukrainian","France, Malta, USA",1 win & 2 nominations.,"[{'Source': 'Internet Movie Database', 'Value': '5.2/10'}, {'Source': 'Rotten Tomatoes', 'Value': '35%'}, {'Source': 'Metacritic', 'Value': '44/100'}]",44,5.2,"13,083",tt3707106,movie,05 Jul 2016,"$319,968",Universal Pictures,http://www.bytheseamovie.net,b'Uni.',"b'$538,460'",b'142',"b'$96,250'",b'10',b'11/13/2015'
By the Sword,1991,R,07 Oct 1992,91 min,"Adventure, Drama, Sport",Jeremy Kagan,"James Donadio, John McDonald","F. Murray Abraham, Eric Roberts, Mia Sara, Christopher Rydell",English,USA,N/A,"[{'Source': 'Internet Movie Database', 'Value': '6.4/10'}]",N/A,6.4,"1,284",tt0101524,movie,27 Jul 1994,N/A,Sony Pictures Home Entertainment,N/A,b'Hns.',"b'$6,220'",b'9',"b'$4,078'",b'9',b'9/24/1993'
The Bye Bye Man,2017,PG-13,13 Jan 2017,97 min,"Horror, Thriller",Stacy Title,"Jonathan Penner (screenplay by), Robert Damon Schneck (based on ""The Bridge to Body Island"" by)","Douglas Smith, Lucien Laviscount, Cressida Bonas, Doug Jones",English,"USA, China",N/A,"[{'Source': 'Internet Movie Database', 'Value': '4.3/10'}, {'Source': 'Rotten Tomatoes', 'Value': '23%'}, {'Source': 'Metacritic', 'Value': '37/100'}]",37,4.3,"11,393",tt4030600,movie,25 Apr 2017,"$22,377,458",STX Entertainment,N/A,b'STX',"b'$22,395,806'","b'2,220'","b'$13,501,349'","b'2,220'",b'1/13/2017'
"Bye Bye, Love",2011,N/A,01 Jun 2011,19 min,"Short, Drama",Jose Val Bal,Jose Val Bal,"Jason Altman, Susan Kirby, Kyla Schoer",English,USA,N/A,[],N/A,N/A,N/A,tt2639596,movie,N/A,N/A,N/A,N/A,b'Fox',"b'$12,096,673'","b'1,379'","b'$4,523,048'","b'1,378'",b'3/17/1995'
Byzantium,2012,R,31 May 2013,118 min,"Drama, Fantasy, Horror",Neil Jordan,"Moira Buffini (screenplay), Moira Buffini (play)","Saoirse Ronan, Barry Cassin, Gemma Arterton, David Heap",English,"UK, USA, Ireland",2 wins & 5 nominations.,"[{'Source': 'Internet Movie Database', 'Value': '6.5/10'}, {'Source': 'Rotten Tomatoes', 'Value': '64%'}, {'Source': 'Metacritic', 'Value': '66/100'}]",66,6.5,"34,871",tt1531901,movie,29 Oct 2013,"$84,293",IFC Films,http://www.ifcfilms.com/films/byzantium,b'IFC',"b'$89,237'",b'13',"b'$16,643'",b'6',b'6/28/2013'
